{"schemaVersion":2,"kernel":"identity","case":"default","options":{},"source_path":"kernels/reshape/identity/identity.asm","source":"{#- ==========================================================================\n    identity.asm -- the smallest kernel: copies x to y unchanged\n\n    Copies a ROWS x 128 FP32 matrix from CR2 to CR3, one XMEM row at a time.\n\n    CR0 and CR1 are read-only hardware constants; CR1 reads as the scalar\n    1.0, so MULT.VE is an identity operation.\n\n    ABI (kernel.toml [abi]):\n      CR2 = x, the input base row\n      CR3 = y, the output base row\n      CR4 = rows\n      CR15.valid_elements = 128\n\n    XMEM operands are row numbers. One FP32 row is 512 bytes.\n========================================================================== -#}\n\n{%- set lr_zero = \"LR0\" -%}\n{%- set lr_row  = \"LR1\" -%}\n\n    SET {{lr_zero}} CR0 ;\n    SET {{lr_row}} CR0 ;;\n\nrow_loop:\n    LD.MULT R0 {{lr_row}} CR2 ;;\n    MULT.VE {{lr_zero}} CR1 0 {{lr_zero}} CR15.L {{ cr.qf }}.L ;\n    ACC.ADD.FIRST ;;\n    ACTIVATE.EXACT identity CR15.L CR3 {{lr_row}} ;;\n    ADD {{lr_row}} {{lr_row}} CR1 ;;\n    BLT.S {{lr_row}} CR4 row_loop ;;\n    HALT ;;\n","meta":{"format":"fp32","variant":"fp32","element_bits":32,"accumulator":"fp32","emulator_only":true,"nx8":null,"lut":null},"trace":{"schema_version":"1.1.0","isa_digest":"b2c6f0be6d069626fb447e271b7ccbf5eadf3579eef718a10f824f16cb7f8599","program_digest":"feb97e08a942001106d5cc1006f8fc5bcabdeab65b37506bd452f825a9c20f23"},"program":[{"label":null,"word":"1800000010000101080000c0018000000c0000000000000200000","slots":[{"slot":"lr","instance":0,"op":"SET","args":["LR0","CR0"]},{"slot":"lr","instance":1,"op":"SET","args":["LR1","CR0"]}]},{"label":"row_loop","word":"180000080000800008000008418000000c0000000000000200000","slots":[{"slot":"load","instance":0,"op":"LD.MULT","args":["R0","LR1","CR2"]}]},{"label":null,"word":"1800000800008000080000c00207dc00020000000000000200000","slots":[{"slot":"mult","instance":0,"op":"MULT.VE","args":["LR0","CR1","0","LR0","CR15.L","CR14.L"]},{"slot":"acc","instance":0,"op":"ACC.ADD.FIRST","args":[]}]},{"label":null,"word":"1800000800008000080000c0018000000c00000000081f8600000","slots":[{"slot":"aaq_exact","instance":0,"op":"ACTIVATE.EXACT","args":["IDENTITY","CR15.L","CR3","LR1"]}]},{"label":null,"word":"1800000111118000080000c0018000000c0000000000000200000","slots":[{"slot":"lr","instance":0,"op":"ADD","args":["LR1","LR1","CR1"]}]},{"label":null,"word":"801054800008000080000c0018000000c0000000000000200000","slots":[{"slot":"cond","instance":0,"op":"BLT.S","args":["LR1","CR4","row_loop"]}]},{"label":null,"word":"1400000800008000080000c0018000000c0000000000000200000","slots":[{"slot":"cond","instance":0,"op":"HALT","args":[]}]}],"layout":[["cond_inst_token_0_cond_inst_opcode",3,"cond"],["cond_inst_token_1_label_token",10,"cond"],["cond_inst_token_2_lcr_half_reg_field",6,"cond"],["cond_inst_token_3_lcr_half_reg_field",6,"cond"],["lr_inst_0_token_0_lr_inst_opcode",4,"lr"],["lr_inst_0_token_1_addbi_immediate",8,"lr"],["lr_inst_0_token_2_lr_reg_field",4,"lr"],["lr_inst_0_token_3_lr_reg_field",4,"lr"],["lr_inst_1_token_0_lr_inst_opcode",4,"lr"],["lr_inst_1_token_1_addbi_immediate",8,"lr"],["lr_inst_1_token_2_lr_reg_field",4,"lr"],["lr_inst_1_token_3_lr_reg_field",4,"lr"],["lr_inst_2_token_0_lr_inst_opcode",4,"lr"],["lr_inst_2_token_1_addbi_immediate",8,"lr"],["lr_inst_2_token_2_lr_reg_field",4,"lr"],["lr_inst_2_token_3_lr_reg_field",4,"lr"],["load_inst_token_0_load_inst_opcode",2,"load"],["load_inst_token_1_cr_reg_field",4,"load"],["load_inst_token_2_lr_reg_field",4,"load"],["load_inst_token_3_lr_reg_field",4,"load"],["mult_inst_token_0_mult_inst_opcode",3,"mult"],["mult_inst_token_1_lcr_reg_field",5,"mult"],["mult_inst_token_2_half_cr_reg_field",5,"mult"],["mult_inst_token_3_half_cr_reg_field",5,"mult"],["mult_inst_token_4_lr_reg_field",4,"mult"],["mult_inst_token_5_lr_reg_field",4,"mult"],["mult_inst_token_6_mult_mask_offset_immediate",3,"mult"],["acc_inst_token_0_acc_inst_opcode",4,"acc"],["acc_inst_token_1_half_cr_reg_field",5,"acc"],["acc_inst_token_2_lrd_reg_field",3,"acc"],["acc_inst_token_3_lr_reg_field",4,"acc"],["acc_inst_token_4_vertical_stride_field",2,"acc"],["aaq_inst_token_0_aaq_inst_opcode",2,"aaq"],["aaq_inst_token_1_aaq_activation_fn_field",3,"aaq"],["aaq_inst_token_2_cr_reg_field",4,"aaq"],["aaq_inst_token_3_half_cr_reg_field",5,"aaq"],["aaq_inst_token_4_half_cr_reg_field",5,"aaq"],["aaq_inst_token_5_lr_reg_field",4,"aaq"],["aaq_exact_inst_token_0_aaq_exact_inst_opcode",1,"aaq_exact"],["aaq_exact_inst_token_1_activation_fn_field",4,"aaq_exact"],["aaq_exact_inst_token_2_cr_reg_field",4,"aaq_exact"],["aaq_exact_inst_token_3_half_cr_reg_field",5,"aaq_exact"],["aaq_exact_inst_token_4_lr_reg_field",4,"aaq_exact"],["break_inst_token_0_break_inst_opcode",2,"break"],["break_inst_token_1_break_immediate_type",16,"break"],["break_inst_token_2_lr_reg_field",4,"break"]],"init":{"r":"00000000000000000000000000000000000000000000000000000000000000000000000000000000000000000000000000000000000000000000000000000000000000000000000000000000000000000000000000000000000000000000000000000000000000000000000000000000000000000000000000000000000000000000000000000000000000000000000000000000000000000000000000000000000000000000000000000000000000000000000000000000000000000000000000000000000000000000000000000000000000000000000000000000000000000000000000000000000000000000000000000000000000000000000000000000","r_wide_debug":"00000000000000000000000000000000000000000000000000000000000000000000000000000000000000000000000000000000000000000000000000000000000000000000000000000000000000000000000000000000000000000000000000000000000000000000000000000000000000000000000000000000000000000000000000000000000000000000000000000000000000000000000000000000000000000000000000000000000000000000000000000000000000000000000000000000000000000000000000000000000000000000000000000000000000000000000000000000000000000000000000000000000000000000000000000000000000000000000000000000000000000000000000000000000000000000000000000000000000000000000000000000000000000000000000000000000000000000000000000000000000000000000000000000000000000000000000000000000000000000000000000000000000000000000000000000000000000000000000000000000000000000000000000000000000000000000000000000000000000000000000000000000000000000000000000000000000000000000000000000000000000000000000000000000000000000000000000000000000000000000000000000000000000000000000000000000000000000000000000000000000000000000000000000000000000000000000000000000000000000000000000000000000000000000000000000000000000000000000000000000000000000000000000000000000000000000000000000000000000000000000000000000000000000000000000000000000000000000000000000000000000000000000000000000000000000000000000000000000000000000000000000000000000000000000000000000000000000000000000000000000000000000000000000000000000000000000000000000000000000000000000000000000000000000000000000000000000000000000000000000000000000000000000000000000000000000000000000000000000000000000000000000000000000000000000000000000000000000000000000000000000000000000000000000000000000000000000000000000000000000000000000000000000000000000000000000000000000000000000000000000000000000000000000000000000000000000000000000000000000000000000000000000000000000000000000000000000000000000000000000000000000000000000000000000000000000000000000000000000000000000000000000000000000000000000000000000000000000000000000000000000000000000000000000000000000000000000000000000000000000000000000","r_cyclic":"0000000000000000000000000000000000000000000000000000000000000000000000000000000000000000000000000000000000000000000000000000000000000000000000000000000000000000000000000000000000000000000000000000000000000000000000000000000000000000000000000000000000000000000000000000000000000000000000000000000000000000000000000000000000000000000000000000000000000000000000000000000000000000000000000000000000000000000000000000000000000000000000000000000000000000000000000000000000000000000000000000000000000000000000000000000000000000000000000000000000000000000000000000000000000000000000000000000000000000000000000000000000000000000000000000000000000000000000000000000000000000000000000000000000000000000000000000000000000000000000000000000000000000000000000000000000000000000000000000000000000000000000000000000000000000000000000000000000000000000000000000000000000000000000000000000000000000000000000000000000000000000000000000000000000000000000000000000000000000000000000000000000000000000000000000000000000000000000000000000000000000","r_cyclic_wide_debug":"000000000000000000000000000000000000000000000000000000000000000000000000000000000000000000000000000000000000000000000000000000000000000000000000000000000000000000000000000000000000000000000000000000000000000000000000000000000000000000000000000000000000000000000000000000000000000000000000000000000000000000000000000000000000000000000000000000000000000000000000000000000000000000000000000000000000000000000000000000000000000000000000000000000000000000000000000000000000000000000000000000000000000000000000000000000000000000000000000000000000000000000000000000000000000000000000000000000000000000000000000000000000000000000000000000000000000000000000000000000000000000000000000000000000000000000000000000000000000000000000000000000000000000000000000000000000000000000000000000000000000000000000000000000000000000000000000000000000000000000000000000000000000000000000000000000000000000000000000000000000000000000000000000000000000000000000000000000000000000000000000000000000000000000000000000000000000000000000000000000000000000000000000000000000000000000000000000000000000000000000000000000000000000000000000000000000000000000000000000000000000000000000000000000000000000000000000000000000000000000000000000000000000000000000000000000000000000000000000000000000000000000000000000000000000000000000000000000000000000000000000000000000000000000000000000000000000000000000000000000000000000000000000